{
  "$schema": "https://json-schema.org/draft/2020-12/schema",
  "$id": "https://agent-hq.dev/schemas/state.schema.json",
  "title": "Per-ticket state document",
  "type": "object",
  "additionalProperties": false,
  "required": ["ticket_id", "status", "runs"],
  "properties": {
    "ticket_id": { "type": "string" },
    "pinned_comment_id": { "type": ["string", "integer", "null"] },
    "status": { "type": "string", "enum": ["ACTIVE", "AWAITING_MERGE", "BLOCKED", "DONE"] },
    "block_reason": { "type": ["string", "null"] },
    "block_source": { "type": ["string", "null"] },
    "interrupted_run_id": { "type": ["string", "null"] },
    "comments_polled_at": {
      "type": ["string", "null"],
      "description": "Watermark for the sweep's poll of the ENGINE ISSUE thread (the ticket-level control surface). Distinct from the per-work_repo watermark of the same name: comment ids are unique per repository, so each subject tracks its own. A watermark, not the dedupe -- a comment-sourced run's id derives from the comment id."
    },
    "work_repos": {
      "type": "array",
      "items": { "$ref": "#/$defs/work_repo" }
    },
    "runs": {
      "type": "array",
      "items": { "$ref": "#/$defs/run" }
    }
  },
  "$defs": {
    "work_repo": {
      "type": "object",
      "additionalProperties": false,
      "required": ["repo"],
      "properties": {
        "repo": { "type": "string" },
        "branch": { "type": ["string", "null"] },
        "pr_ref": { "type": ["string", "null"] },
        "recorded_head": { "type": ["string", "null"] },
        "base_branch": { "type": ["string", "null"] },
        "comments_polled_at": {
          "type": ["string", "null"],
          "description": "Watermark for the sweep's PR-comment poll: only comments created at or after this are considered. A watermark, not the dedupe -- comment ids are deduped through the event log."
        }
      }
    },
    "handoff": {
      "type": "object",
      "additionalProperties": false,
      "required": ["key", "target_task", "reason"],
      "properties": {
        "key": { "type": "string" },
        "target_task": { "type": "string" },
        "reason": { "type": "string" },
        "repo": { "type": ["string", "null"] },
        "artifacts": { "type": "array", "items": { "type": "string" } },
        "source_run_id": { "type": ["string", "null"] }
      }
    },
    "run": {
      "type": "object",
      "additionalProperties": false,
      "required": [
        "run_id",
        "task_id",
        "task_version",
        "ticket_id",
        "state",
        "attempt",
        "bindings",
        "cost_usd",
        "tokens",
        "usage_known",
        "artifacts",
        "chain_depth"
      ],
      "properties": {
        "run_id": { "type": "string" },
        "task_id": { "type": "string" },
        "task_version": { "type": "integer", "minimum": 1 },
        "ticket_id": { "type": "string" },
        "state": {
          "type": "string",
          "enum": ["QUEUED", "RUNNING", "WAITING_GATE", "SUCCEEDED", "FAILED", "BLOCKED", "CANCELLED"]
        },
        "deadline": { "type": ["string", "null"] },
        "attempt_started_at": { "type": ["string", "null"] },
        "gate_requested_at": { "type": ["string", "null"] },
        "gate_request_id": { "type": ["string", "integer", "null"] },
        "base_commit": { "type": ["string", "null"] },
        "output_commit": { "type": ["string", "null"] },
        "pr_ref": { "type": ["string", "null"] },
        "attempt": { "type": "integer", "minimum": 0 },
        "parent_run_id": { "type": ["string", "null"] },
        "source_event_id": { "type": ["string", "null"] },
        "enqueue_index": { "type": ["integer", "null"] },
        "input_from_run_id": {
          "type": ["string", "null"],
          "description": "The run whose recorded artifacts this run consumed. Resolved and recorded when the run is claimed -- the nearest SUCCEEDED run ahead of it in the queue, else the run that enqueued it. Distinct from parent_run_id: one run may declare several queue entries at once, so the run that enqueued `review` need not be the run whose output `review` reads. Recorded rather than recomputed so the ledger says what a run actually read."
        },
        "queue_seq": {
          "type": "integer",
          "minimum": 0,
          "description": "This run's position in the ticket's queue. Dispatch orders QUEUED runs by it, so queue position is stored rather than inferred from array order. Absent on runs written before it existed: readers fall back to the run's array index, which is exactly the order dispatch used then. A retry inherits the position of the attempt it replaces, so it resumes where that attempt sat rather than moving behind everything queued after it."
        },
        "handoff_key": { "type": ["string", "null"] },
        "repo": { "type": ["string", "null"] },
        "input_artifacts": { "type": "array", "items": { "type": "string" } },
        "pending_handoffs": {
          "type": "array",
          "items": { "$ref": "#/$defs/handoff" }
        },
        "bindings": {
          "type": "object",
          "description": "Port name -> concrete adapter used for this run",
          "additionalProperties": { "type": "string" }
        },
        "cost_usd": { "type": ["number", "null"] },
        "tokens": { "type": ["integer", "null"] },
        "usage_known": { "type": "boolean" },
        "artifacts": { "type": "array", "items": { "type": "string" } },
        "chain_depth": { "type": "integer", "minimum": 0 },
        "mcp_servers": {
          "type": "array",
          "items": { "type": "string", "minLength": 1 },
          "description": "MCP server names from the taskdef catalog that prepare resolved into the execute bundle. Absent or empty means no MCP for this run (script-based qa and every non-MCP task). Distinct from mcp_loaded: this is intent/offer, not proof the child used the tools."
        },
        "mcp_loaded": {
          "type": "boolean",
          "description": "True when the executor reported it force-loaded the run's MCP servers into the agent session (e.g. wrote .mcp.json and passed Copilot -p workspace-MCP opts). Recorded at collect from execute-result.json. False/absent does not prove tools were unused — only that load was not confirmed."
        }
      }
    }
  }
}
