{
  "ticket_id": "9",
  "pinned_comment_id": 5193677982,
  "status": "ACTIVE",
  "runs": [
    {
      "run_id": "8d1ffe7b5c67fe67",
      "task_id": "spec",
      "task_version": 1,
      "ticket_id": "9",
      "state": "SUCCEEDED",
      "attempt": 0,
      "bindings": {
        "tracker": "github-issues",
        "agent-session": "copilot-cli",
        "messaging": "github-comment",
        "gate": "github-issue-comment"
      },
      "cost_usd": 0.397,
      "tokens": 498900,
      "usage_known": true,
      "artifacts": [
        "specs/9/spec.md"
      ],
      "chain_depth": 0,
      "source_event_id": "9:opened:2026-08-05T15:19:22Z",
      "enqueue_index": 0,
      "queue_seq": 0,
      "repo": "yash-learner/care_fe_agent_hq",
      "deadline": "2026-08-05T15:50:54Z",
      "attempt_started_at": "2026-08-05T15:20:54Z",
      "base_commit": "dea49853619eaf2e5b7c18d6f89a1c1bf67567a0",
      "input_from_run_id": null,
      "input_artifacts": [],
      "output_commit": "dea49853619eaf2e5b7c18d6f89a1c1bf67567a0",
      "pr_ref": null
    },
    {
      "run_id": "eb8043ee1ace478d",
      "task_id": "arch-plan",
      "task_version": 1,
      "ticket_id": "9",
      "state": "SUCCEEDED",
      "attempt": 0,
      "bindings": {
        "tracker": "github-issues",
        "agent-session": "copilot-cli",
        "messaging": "github-comment"
      },
      "cost_usd": 0.179,
      "tokens": 213300,
      "usage_known": true,
      "artifacts": [
        "specs/9/plan.md",
        "specs/9/classification.json"
      ],
      "chain_depth": 1,
      "parent_run_id": "8d1ffe7b5c67fe67",
      "queue_seq": 1,
      "handoff_key": "arch-plan-9",
      "repo": "yash-learner/care_fe_agent_hq",
      "input_artifacts": [
        "specs/9/spec.md"
      ],
      "deadline": "2026-08-05T15:55:45Z",
      "attempt_started_at": "2026-08-05T15:25:45Z",
      "base_commit": "dea49853619eaf2e5b7c18d6f89a1c1bf67567a0",
      "input_from_run_id": "8d1ffe7b5c67fe67",
      "output_commit": "dea49853619eaf2e5b7c18d6f89a1c1bf67567a0",
      "pr_ref": null
    },
    {
      "run_id": "d03722c8cccd1381",
      "task_id": "breakdown",
      "task_version": 1,
      "ticket_id": "9",
      "state": "SUCCEEDED",
      "attempt": 0,
      "bindings": {
        "tracker": "github-issues",
        "agent-session": "copilot-cli",
        "messaging": "github-comment"
      },
      "cost_usd": 0.181,
      "tokens": 245000,
      "usage_known": true,
      "artifacts": [
        "specs/9/tasks.md"
      ],
      "chain_depth": 2,
      "parent_run_id": "eb8043ee1ace478d",
      "queue_seq": 2,
      "handoff_key": "breakdown-9",
      "repo": "yash-learner/care_fe_agent_hq",
      "input_artifacts": [
        "specs/9/spec.md",
        "specs/9/plan.md",
        "specs/9/classification.json"
      ],
      "deadline": "2026-08-05T16:00:03Z",
      "attempt_started_at": "2026-08-05T15:30:03Z",
      "base_commit": "dea49853619eaf2e5b7c18d6f89a1c1bf67567a0",
      "input_from_run_id": "eb8043ee1ace478d",
      "output_commit": "dea49853619eaf2e5b7c18d6f89a1c1bf67567a0",
      "pr_ref": null
    },
    {
      "run_id": "33c4e58833ffe489",
      "task_id": "implement",
      "task_version": 1,
      "ticket_id": "9",
      "state": "SUCCEEDED",
      "attempt": 0,
      "bindings": {
        "tracker": "github-issues",
        "agent-session": "copilot-cli",
        "messaging": "github-comment"
      },
      "cost_usd": 0.727,
      "tokens": 1409500,
      "usage_known": true,
      "artifacts": [
        "specs/9/qa-plan.md"
      ],
      "chain_depth": 3,
      "parent_run_id": "d03722c8cccd1381",
      "queue_seq": 3,
      "handoff_key": "implement-fe",
      "repo": "yash-learner/care_fe_agent_hq",
      "input_artifacts": [
        "specs/9/spec.md",
        "specs/9/plan.md",
        "specs/9/tasks.md",
        "specs/9/classification.json"
      ],
      "deadline": "2026-08-05T17:04:35Z",
      "attempt_started_at": "2026-08-05T15:34:35Z",
      "base_commit": "dea49853619eaf2e5b7c18d6f89a1c1bf67567a0",
      "input_from_run_id": "d03722c8cccd1381",
      "output_commit": "639a9a2d2270949207f5514d05e66fa83a725f4b",
      "pr_ref": "yash-learner/care_fe_agent_hq#4"
    },
    {
      "run_id": "3ff438f1cbe763ec",
      "task_id": "review",
      "task_version": 1,
      "ticket_id": "9",
      "state": "SUCCEEDED",
      "attempt": 0,
      "bindings": {
        "tracker": "github-issues",
        "agent-session": "copilot-cli",
        "messaging": "github-comment"
      },
      "cost_usd": 0.296,
      "tokens": 455200,
      "usage_known": true,
      "artifacts": [
        "specs/9/review.md"
      ],
      "chain_depth": 4,
      "parent_run_id": "33c4e58833ffe489",
      "queue_seq": 4,
      "handoff_key": "review-1",
      "repo": "yash-learner/care_fe_agent_hq",
      "input_artifacts": [
        "specs/9/spec.md",
        "specs/9/qa-plan.md"
      ],
      "deadline": "2026-08-05T16:15:47Z",
      "attempt_started_at": "2026-08-05T15:45:47Z",
      "base_commit": "639a9a2d2270949207f5514d05e66fa83a725f4b",
      "input_from_run_id": "33c4e58833ffe489",
      "output_commit": "639a9a2d2270949207f5514d05e66fa83a725f4b",
      "pr_ref": "yash-learner/care_fe_agent_hq#4"
    },
    {
      "run_id": "c0ec5760b3da5a9f",
      "task_id": "qa",
      "task_version": 1,
      "ticket_id": "9",
      "state": "QUEUED",
      "attempt": 0,
      "bindings": {
        "tracker": "github-issues",
        "agent-session": "copilot-cli",
        "messaging": "github-comment"
      },
      "cost_usd": null,
      "tokens": null,
      "usage_known": false,
      "artifacts": [],
      "chain_depth": 5,
      "parent_run_id": "3ff438f1cbe763ec",
      "queue_seq": 5,
      "handoff_key": "qa-9",
      "repo": "yash-learner/care_fe_agent_hq",
      "input_artifacts": [
        "specs/9/spec.md",
        "specs/9/review.md",
        "specs/9/qa-plan.md"
      ]
    }
  ],
  "block_reason": null,
  "block_source": null,
  "interrupted_run_id": null,
  "comments_polled_at": "2026-08-05T15:24:59Z",
  "work_repos": [
    {
      "repo": "yash-learner/care_fe_agent_hq",
      "branch": "agent-hq/9",
      "base_branch": "develop",
      "recorded_head": "639a9a2d2270949207f5514d05e66fa83a725f4b",
      "pr_ref": "yash-learner/care_fe_agent_hq#4",
      "comments_polled_at": "2026-08-05T15:45:10Z"
    }
  ]
}
