{
  "ticket_id": "23",
  "pinned_comment_id": 5217524501,
  "status": "ACTIVE",
  "runs": [
    {
      "run_id": "f15d98e868cc230d",
      "task_id": "spec",
      "task_version": 1,
      "ticket_id": "23",
      "state": "SUCCEEDED",
      "attempt": 0,
      "bindings": {
        "tracker": "github-issues",
        "agent-session": "copilot-cli",
        "messaging": "github-comment",
        "gate": "github-issue-comment"
      },
      "cost_usd": 0.32,
      "tokens": 416300,
      "usage_known": true,
      "artifacts": [
        "specs/23/spec.md"
      ],
      "chain_depth": 0,
      "source_event_id": "23:labeled:2026-08-07T13:13:52Z",
      "enqueue_index": 0,
      "queue_seq": 0,
      "repo": "yash-learner/care_fe_agent_hq",
      "deadline": "2026-08-07T14:11:34Z",
      "attempt_started_at": "2026-08-07T13:41:34Z",
      "base_commit": "dea49853619eaf2e5b7c18d6f89a1c1bf67567a0",
      "input_from_run_id": null,
      "input_artifacts": [],
      "output_commit": "dea49853619eaf2e5b7c18d6f89a1c1bf67567a0",
      "pr_ref": null
    },
    {
      "run_id": "390551a7d6c03cec",
      "task_id": "implement",
      "task_version": 1,
      "ticket_id": "23",
      "state": "SUCCEEDED",
      "attempt": 0,
      "bindings": {
        "tracker": "github-issues",
        "agent-session": "copilot-cli",
        "messaging": "github-comment"
      },
      "cost_usd": 1.58,
      "tokens": 3119100,
      "usage_known": true,
      "artifacts": [
        "specs/23/qa-plan.md"
      ],
      "chain_depth": 1,
      "parent_run_id": "f15d98e868cc230d",
      "queue_seq": 1,
      "handoff_key": "implement-23-care-fe",
      "repo": "yash-learner/care_fe_agent_hq",
      "input_artifacts": [
        "specs/23/spec.md"
      ],
      "deadline": "2026-08-07T15:16:34Z",
      "attempt_started_at": "2026-08-07T13:46:34Z",
      "base_commit": "dea49853619eaf2e5b7c18d6f89a1c1bf67567a0",
      "input_from_run_id": "f15d98e868cc230d",
      "output_commit": "fd265559349698cc0ea50bbec6259762bc34cc23",
      "pr_ref": "yash-learner/care_fe_agent_hq#13"
    },
    {
      "run_id": "c2b758d12b550dfb",
      "task_id": "review",
      "task_version": 1,
      "ticket_id": "23",
      "state": "SUCCEEDED",
      "attempt": 0,
      "bindings": {
        "tracker": "github-issues",
        "agent-session": "copilot-cli",
        "messaging": "github-comment"
      },
      "cost_usd": 0.266,
      "tokens": 279000,
      "usage_known": true,
      "artifacts": [
        "specs/23/review.md"
      ],
      "chain_depth": 2,
      "parent_run_id": "390551a7d6c03cec",
      "queue_seq": 2,
      "handoff_key": "review-23-impl",
      "repo": "yash-learner/care_fe_agent_hq",
      "input_artifacts": [
        "specs/23/spec.md",
        "specs/23/qa-plan.md"
      ],
      "deadline": "2026-08-07T14:28:56Z",
      "attempt_started_at": "2026-08-07T13:58:56Z",
      "base_commit": "fd265559349698cc0ea50bbec6259762bc34cc23",
      "input_from_run_id": "390551a7d6c03cec",
      "output_commit": "fd265559349698cc0ea50bbec6259762bc34cc23",
      "pr_ref": "yash-learner/care_fe_agent_hq#13"
    },
    {
      "run_id": "a282dfbf3efe926f",
      "task_id": "implement",
      "task_version": 1,
      "ticket_id": "23",
      "state": "SUCCEEDED",
      "attempt": 0,
      "bindings": {
        "tracker": "github-issues",
        "agent-session": "copilot-cli",
        "messaging": "github-comment"
      },
      "cost_usd": 0.747,
      "tokens": 1311200,
      "usage_known": true,
      "artifacts": [
        "specs/23/qa-plan.md"
      ],
      "chain_depth": 3,
      "parent_run_id": "c2b758d12b550dfb",
      "queue_seq": 3,
      "handoff_key": "implement-r2",
      "repo": "yash-learner/care_fe_agent_hq",
      "input_artifacts": [
        "specs/23/spec.md",
        "specs/23/review.md"
      ],
      "deadline": "2026-08-07T15:33:49Z",
      "attempt_started_at": "2026-08-07T14:03:49Z",
      "base_commit": "fd265559349698cc0ea50bbec6259762bc34cc23",
      "input_from_run_id": "c2b758d12b550dfb",
      "output_commit": "6638eaf59790c3cd6325ae1e3c6c4d0f1984cc89",
      "pr_ref": "yash-learner/care_fe_agent_hq#13"
    },
    {
      "run_id": "500bf36883cef3df",
      "task_id": "review",
      "task_version": 1,
      "ticket_id": "23",
      "state": "FAILED",
      "attempt": 0,
      "bindings": {
        "tracker": "github-issues",
        "agent-session": "copilot-cli",
        "messaging": "github-comment"
      },
      "cost_usd": null,
      "tokens": null,
      "usage_known": false,
      "artifacts": [],
      "chain_depth": 4,
      "parent_run_id": "a282dfbf3efe926f",
      "queue_seq": 4,
      "handoff_key": "23-review-2",
      "repo": "yash-learner/care_fe_agent_hq",
      "input_artifacts": [
        "specs/23/spec.md",
        "specs/23/review.md",
        "specs/23/qa-plan.md"
      ],
      "deadline": "2026-08-07T14:41:43Z",
      "attempt_started_at": "2026-08-07T14:11:43Z",
      "base_commit": "6638eaf59790c3cd6325ae1e3c6c4d0f1984cc89",
      "input_from_run_id": "a282dfbf3efe926f"
    },
    {
      "run_id": "8a05cff399bc151d",
      "task_id": "review",
      "task_version": 1,
      "ticket_id": "23",
      "state": "SUCCEEDED",
      "attempt": 1,
      "bindings": {
        "tracker": "github-issues",
        "agent-session": "copilot-cli",
        "messaging": "github-comment"
      },
      "cost_usd": 0.421,
      "tokens": 545700,
      "usage_known": true,
      "artifacts": [
        "specs/23/review.md"
      ],
      "chain_depth": 4,
      "parent_run_id": "a282dfbf3efe926f",
      "queue_seq": 4,
      "handoff_key": "23-review-2",
      "repo": "yash-learner/care_fe_agent_hq",
      "input_artifacts": [
        "specs/23/spec.md",
        "specs/23/review.md",
        "specs/23/qa-plan.md"
      ],
      "deadline": "2026-08-07T15:23:48Z",
      "attempt_started_at": "2026-08-07T14:53:48Z",
      "base_commit": "6638eaf59790c3cd6325ae1e3c6c4d0f1984cc89",
      "input_from_run_id": "a282dfbf3efe926f",
      "output_commit": "6638eaf59790c3cd6325ae1e3c6c4d0f1984cc89",
      "pr_ref": "yash-learner/care_fe_agent_hq#13"
    },
    {
      "run_id": "eba7babe3909a3a6",
      "task_id": "implement",
      "task_version": 1,
      "ticket_id": "23",
      "state": "QUEUED",
      "attempt": 0,
      "bindings": {
        "tracker": "github-issues",
        "agent-session": "copilot-cli",
        "messaging": "github-comment"
      },
      "cost_usd": null,
      "tokens": null,
      "usage_known": false,
      "artifacts": [],
      "chain_depth": 5,
      "parent_run_id": "8a05cff399bc151d",
      "queue_seq": 5,
      "handoff_key": "implement-3",
      "repo": "yash-learner/care_fe_agent_hq",
      "input_artifacts": [
        "specs/23/spec.md",
        "specs/23/review.md",
        "specs/23/qa-plan.md"
      ]
    }
  ],
  "block_reason": null,
  "block_source": null,
  "interrupted_run_id": null,
  "comments_polled_at": "2026-08-07T13:45:44Z",
  "work_repos": [
    {
      "repo": "yash-learner/care_fe_agent_hq",
      "branch": "agent-hq/23",
      "base_branch": "develop",
      "recorded_head": "6638eaf59790c3cd6325ae1e3c6c4d0f1984cc89",
      "pr_ref": "yash-learner/care_fe_agent_hq#13",
      "comments_polled_at": "2026-08-07T14:58:45Z"
    }
  ]
}
