{
  "ticket_id": "40",
  "pinned_comment_id": 5239618953,
  "status": "ACTIVE",
  "runs": [
    {
      "run_id": "c70ab85fe07d50a4",
      "task_id": "spec",
      "task_version": 1,
      "ticket_id": "40",
      "state": "FAILED",
      "attempt": 0,
      "bindings": {
        "tracker": "github-issues",
        "agent-session": "copilot-cli",
        "messaging": "github-comment",
        "gate": "github-issue-comment"
      },
      "cost_usd": 0.433,
      "tokens": 635800,
      "usage_known": true,
      "artifacts": [],
      "chain_depth": 0,
      "source_event_id": "40:opened:2026-08-10T11:38:49Z",
      "enqueue_index": 0,
      "queue_seq": 0,
      "repo": "yash-learner/care_fe_agent_hq",
      "deadline": "2026-08-10T12:10:16Z",
      "attempt_started_at": "2026-08-10T11:40:16Z",
      "base_commit": "dea49853619eaf2e5b7c18d6f89a1c1bf67567a0",
      "input_from_run_id": null,
      "input_artifacts": []
    },
    {
      "run_id": "a742499562f57458",
      "task_id": "spec",
      "task_version": 1,
      "ticket_id": "40",
      "state": "SUCCEEDED",
      "attempt": 1,
      "bindings": {
        "tracker": "github-issues",
        "agent-session": "copilot-cli",
        "messaging": "github-comment",
        "gate": "github-issue-comment"
      },
      "cost_usd": 0.404,
      "tokens": 644400,
      "usage_known": true,
      "artifacts": [
        "specs/40/spec.md"
      ],
      "chain_depth": 0,
      "source_event_id": "40:opened:2026-08-10T11:38:49Z",
      "enqueue_index": 0,
      "queue_seq": 0,
      "deadline": "2026-08-10T12:16:34Z",
      "attempt_started_at": "2026-08-10T11:46:34Z",
      "base_commit": "dea49853619eaf2e5b7c18d6f89a1c1bf67567a0",
      "input_from_run_id": null,
      "input_artifacts": [],
      "output_commit": "dea49853619eaf2e5b7c18d6f89a1c1bf67567a0",
      "pr_ref": null
    },
    {
      "run_id": "b91fe81916a4ec65",
      "task_id": "implement",
      "task_version": 1,
      "ticket_id": "40",
      "state": "SUCCEEDED",
      "attempt": 0,
      "bindings": {
        "tracker": "github-issues",
        "agent-session": "copilot-cli",
        "messaging": "github-comment"
      },
      "cost_usd": 1.35,
      "tokens": 2319700,
      "usage_known": true,
      "artifacts": [
        "specs/40/qa-plan.md"
      ],
      "chain_depth": 1,
      "parent_run_id": "a742499562f57458",
      "queue_seq": 1,
      "handoff_key": "impl-custom-sidebar-links",
      "repo": "yash-learner/care_fe_agent_hq",
      "input_artifacts": [
        "specs/40/spec.md"
      ],
      "deadline": "2026-08-10T13:22:34Z",
      "attempt_started_at": "2026-08-10T11:52:34Z",
      "base_commit": "dea49853619eaf2e5b7c18d6f89a1c1bf67567a0",
      "input_from_run_id": "a742499562f57458",
      "output_commit": "58551f5dcbe5b70ab24fbc3ee6f68688a82977ef",
      "pr_ref": "yash-learner/care_fe_agent_hq#25"
    },
    {
      "run_id": "49c571824187db13",
      "task_id": "review",
      "task_version": 1,
      "ticket_id": "40",
      "state": "SUCCEEDED",
      "attempt": 0,
      "bindings": {
        "tracker": "github-issues",
        "agent-session": "copilot-cli",
        "messaging": "github-comment"
      },
      "cost_usd": 0.197,
      "tokens": 244600,
      "usage_known": true,
      "artifacts": [
        "specs/40/review.md"
      ],
      "chain_depth": 2,
      "parent_run_id": "b91fe81916a4ec65",
      "queue_seq": 2,
      "handoff_key": "review-40",
      "repo": "yash-learner/care_fe_agent_hq",
      "input_artifacts": [
        "specs/40/spec.md",
        "specs/40/qa-plan.md"
      ],
      "deadline": "2026-08-10T12:36:28Z",
      "attempt_started_at": "2026-08-10T12:06:28Z",
      "base_commit": "58551f5dcbe5b70ab24fbc3ee6f68688a82977ef",
      "input_from_run_id": "b91fe81916a4ec65",
      "output_commit": "58551f5dcbe5b70ab24fbc3ee6f68688a82977ef",
      "pr_ref": "yash-learner/care_fe_agent_hq#25"
    },
    {
      "run_id": "8599135a7cf199df",
      "task_id": "implement",
      "task_version": 1,
      "ticket_id": "40",
      "state": "SUCCEEDED",
      "attempt": 0,
      "bindings": {
        "tracker": "github-issues",
        "agent-session": "copilot-cli",
        "messaging": "github-comment"
      },
      "cost_usd": 0.672,
      "tokens": 1110600,
      "usage_known": true,
      "artifacts": [
        "specs/40/qa-plan.md"
      ],
      "chain_depth": 3,
      "parent_run_id": "49c571824187db13",
      "queue_seq": 3,
      "handoff_key": "implement-round-2",
      "repo": "yash-learner/care_fe_agent_hq",
      "input_artifacts": [
        "specs/40/spec.md",
        "specs/40/review.md"
      ],
      "deadline": "2026-08-10T13:41:04Z",
      "attempt_started_at": "2026-08-10T12:11:04Z",
      "base_commit": "58551f5dcbe5b70ab24fbc3ee6f68688a82977ef",
      "input_from_run_id": "49c571824187db13",
      "output_commit": "e55ee5f3ab9248d90d6e35fb2145af84413ba69f",
      "pr_ref": "yash-learner/care_fe_agent_hq#25"
    },
    {
      "run_id": "82bcfa0a4b14c4c5",
      "task_id": "review",
      "task_version": 1,
      "ticket_id": "40",
      "state": "SUCCEEDED",
      "attempt": 0,
      "bindings": {
        "tracker": "github-issues",
        "agent-session": "copilot-cli",
        "messaging": "github-comment"
      },
      "cost_usd": 0.409,
      "tokens": 573000,
      "usage_known": true,
      "artifacts": [
        "specs/40/review.md"
      ],
      "chain_depth": 4,
      "parent_run_id": "8599135a7cf199df",
      "queue_seq": 4,
      "handoff_key": "review-round-2",
      "repo": "yash-learner/care_fe_agent_hq",
      "input_artifacts": [
        "specs/40/spec.md",
        "specs/40/qa-plan.md",
        "specs/40/review.md"
      ],
      "deadline": "2026-08-10T16:55:48Z",
      "attempt_started_at": "2026-08-10T16:25:48Z",
      "base_commit": "e55ee5f3ab9248d90d6e35fb2145af84413ba69f",
      "input_from_run_id": "8599135a7cf199df",
      "output_commit": "e55ee5f3ab9248d90d6e35fb2145af84413ba69f",
      "pr_ref": "yash-learner/care_fe_agent_hq#25"
    },
    {
      "run_id": "dc643276c9bc588e",
      "task_id": "qa",
      "task_version": 1,
      "ticket_id": "40",
      "state": "FAILED",
      "attempt": 0,
      "bindings": {
        "tracker": "github-issues",
        "agent-session": "copilot-cli",
        "messaging": "github-comment"
      },
      "cost_usd": 1.76,
      "tokens": 3028800,
      "usage_known": true,
      "artifacts": [],
      "chain_depth": 5,
      "parent_run_id": "82bcfa0a4b14c4c5",
      "queue_seq": 5,
      "handoff_key": "qa-40",
      "repo": "yash-learner/care_fe_agent_hq",
      "input_artifacts": [
        "specs/40/spec.md",
        "specs/40/review.md",
        "specs/40/qa-plan.md"
      ],
      "deadline": "2026-08-10T17:36:28Z",
      "attempt_started_at": "2026-08-10T16:36:28Z",
      "base_commit": "e55ee5f3ab9248d90d6e35fb2145af84413ba69f",
      "input_from_run_id": "82bcfa0a4b14c4c5"
    },
    {
      "run_id": "d34c62f3723434f7",
      "task_id": "qa",
      "task_version": 1,
      "ticket_id": "40",
      "state": "FAILED",
      "attempt": 1,
      "bindings": {
        "tracker": "github-issues",
        "agent-session": "copilot-cli",
        "messaging": "github-comment"
      },
      "cost_usd": 2.91,
      "tokens": 6338000,
      "usage_known": true,
      "artifacts": [],
      "chain_depth": 5,
      "parent_run_id": "82bcfa0a4b14c4c5",
      "queue_seq": 5,
      "handoff_key": "qa-40",
      "repo": "yash-learner/care_fe_agent_hq",
      "input_artifacts": [
        "specs/40/spec.md",
        "specs/40/review.md",
        "specs/40/qa-plan.md"
      ],
      "deadline": "2026-08-10T17:59:15Z",
      "attempt_started_at": "2026-08-10T16:59:15Z",
      "base_commit": "e55ee5f3ab9248d90d6e35fb2145af84413ba69f",
      "input_from_run_id": "82bcfa0a4b14c4c5"
    },
    {
      "run_id": "d9cd0676db73f88e",
      "task_id": "qa",
      "task_version": 1,
      "ticket_id": "40",
      "state": "FAILED",
      "attempt": 0,
      "bindings": {
        "tracker": "github-issues",
        "agent-session": "copilot-cli",
        "messaging": "github-comment"
      },
      "cost_usd": 1.63,
      "tokens": 2931300,
      "usage_known": true,
      "artifacts": [],
      "chain_depth": 0,
      "source_event_id": "issue-comment:5251871473",
      "enqueue_index": 0,
      "queue_seq": 6,
      "deadline": "2026-08-11T12:00:33Z",
      "attempt_started_at": "2026-08-11T11:00:33Z",
      "base_commit": "e55ee5f3ab9248d90d6e35fb2145af84413ba69f",
      "input_from_run_id": "82bcfa0a4b14c4c5",
      "input_artifacts": [
        "specs/40/qa-plan.md",
        "specs/40/review.md",
        "specs/40/spec.md"
      ]
    },
    {
      "run_id": "4e562f131df2b06a",
      "task_id": "qa",
      "task_version": 1,
      "ticket_id": "40",
      "state": "QUEUED",
      "attempt": 1,
      "bindings": {
        "tracker": "github-issues",
        "agent-session": "copilot-cli",
        "messaging": "github-comment"
      },
      "cost_usd": null,
      "tokens": null,
      "usage_known": false,
      "artifacts": [],
      "chain_depth": 0,
      "source_event_id": "issue-comment:5251871473",
      "enqueue_index": 0,
      "queue_seq": 6
    }
  ],
  "block_reason": null,
  "block_source": null,
  "interrupted_run_id": null,
  "comments_polled_at": "2026-08-11T10:18:54Z",
  "work_repos": [
    {
      "repo": "yash-learner/care_fe_agent_hq",
      "branch": "agent-hq/40",
      "base_branch": "develop",
      "recorded_head": "e55ee5f3ab9248d90d6e35fb2145af84413ba69f",
      "pr_ref": "yash-learner/care_fe_agent_hq#25",
      "comments_polled_at": "2026-08-10T17:38:02Z"
    }
  ]
}
