{
  "ticket_id": "33",
  "pinned_comment_id": 5221727989,
  "status": "ACTIVE",
  "runs": [
    {
      "run_id": "9248b58cb14e8f8c",
      "task_id": "spec",
      "task_version": 1,
      "ticket_id": "33",
      "state": "RUNNING",
      "attempt": 0,
      "bindings": {},
      "cost_usd": null,
      "tokens": null,
      "usage_known": false,
      "artifacts": [],
      "chain_depth": 0,
      "source_event_id": "33:opened:2026-08-07T20:30:39Z",
      "enqueue_index": 0,
      "queue_seq": 0,
      "repo": "yash-learner/care_fe_agent_hq",
      "deadline": "2026-08-07T21:03:11Z",
      "attempt_started_at": "2026-08-07T20:33:11Z"
    }
  ],
  "block_reason": null,
  "block_source": null,
  "interrupted_run_id": null,
  "comments_polled_at": "2026-08-07T20:31:49Z"
}
