{
  "ticket_id": "56",
  "pinned_comment_id": 5253363418,
  "status": "ACTIVE",
  "runs": [
    {
      "run_id": "f8b3c643f94101f4",
      "task_id": "spec",
      "task_version": 1,
      "ticket_id": "56",
      "state": "QUEUED",
      "attempt": 0,
      "bindings": {},
      "cost_usd": null,
      "tokens": null,
      "usage_known": false,
      "artifacts": [],
      "chain_depth": 0,
      "source_event_id": "56:labeled:2026-08-11T12:46:22Z",
      "enqueue_index": 0,
      "queue_seq": 0,
      "repo": "yash-learner/care_fe_agent_hq"
    }
  ],
  "block_reason": null,
  "block_source": null,
  "interrupted_run_id": null
}
