{
  "ticket_id": "61",
  "pinned_comment_id": 5278049817,
  "status": "ACTIVE",
  "runs": [
    {
      "run_id": "ba7a45670b2644da",
      "task_id": "spec",
      "task_version": 1,
      "ticket_id": "61",
      "state": "SUCCEEDED",
      "attempt": 0,
      "bindings": {
        "tracker": "github-issues",
        "agent-session": "copilot-cli",
        "messaging": "github-comment",
        "gate": "github-issue-comment"
      },
      "cost_usd": 0.611,
      "tokens": 894500,
      "usage_known": true,
      "artifacts": [
        "specs/61/spec.md"
      ],
      "chain_depth": 0,
      "source_event_id": "61:opened:2026-08-13T08:41:25Z",
      "enqueue_index": 0,
      "queue_seq": 0,
      "repo": "yash-learner/care_fe_agent_hq",
      "deadline": "2026-08-13T09:13:00Z",
      "attempt_started_at": "2026-08-13T08:43:00Z",
      "base_commit": "dea49853619eaf2e5b7c18d6f89a1c1bf67567a0",
      "input_from_run_id": null,
      "input_artifacts": [],
      "output_commit": "dea49853619eaf2e5b7c18d6f89a1c1bf67567a0",
      "pr_ref": null
    },
    {
      "run_id": "c43a51a9f4b21a37",
      "task_id": "implement",
      "task_version": 1,
      "ticket_id": "61",
      "state": "RUNNING",
      "attempt": 0,
      "bindings": {
        "tracker": "github-issues",
        "agent-session": "copilot-cli",
        "messaging": "github-comment"
      },
      "cost_usd": 0.862,
      "tokens": 1611900,
      "usage_known": true,
      "artifacts": [],
      "chain_depth": 1,
      "parent_run_id": "ba7a45670b2644da",
      "queue_seq": 1,
      "handoff_key": "implement-61-care-fe",
      "repo": "yash-learner/care_fe_agent_hq",
      "input_artifacts": [
        "specs/61/spec.md"
      ],
      "deadline": "2026-08-13T10:19:44Z",
      "attempt_started_at": "2026-08-13T08:49:44Z",
      "base_commit": "dea49853619eaf2e5b7c18d6f89a1c1bf67567a0",
      "input_from_run_id": "ba7a45670b2644da"
    }
  ],
  "block_reason": null,
  "block_source": null,
  "interrupted_run_id": null,
  "comments_polled_at": "2026-08-13T08:48:31Z",
  "work_repos": [
    {
      "repo": "yash-learner/care_fe_agent_hq",
      "branch": "agent-hq/61",
      "base_branch": "develop",
      "recorded_head": "dea49853619eaf2e5b7c18d6f89a1c1bf67567a0",
      "pr_ref": null
    }
  ]
}
