{
  "ticket_id": "34",
  "pinned_comment_id": 5221727277,
  "status": "ACTIVE",
  "runs": [
    {
      "run_id": "d0a9c2f44340151b",
      "task_id": "spec",
      "task_version": 1,
      "ticket_id": "34",
      "state": "SUCCEEDED",
      "attempt": 0,
      "bindings": {
        "tracker": "github-issues",
        "agent-session": "copilot-cli",
        "messaging": "github-comment",
        "gate": "github-issue-comment"
      },
      "cost_usd": 0.406,
      "tokens": 504100,
      "usage_known": true,
      "artifacts": [
        "specs/34/spec.md"
      ],
      "chain_depth": 0,
      "source_event_id": "34:opened:2026-08-07T20:31:21Z",
      "enqueue_index": 0,
      "queue_seq": 0,
      "repo": "yash-learner/care_fe_agent_hq",
      "deadline": "2026-08-07T21:02:39Z",
      "attempt_started_at": "2026-08-07T20:32:39Z",
      "base_commit": "dea49853619eaf2e5b7c18d6f89a1c1bf67567a0",
      "input_from_run_id": null,
      "input_artifacts": [],
      "output_commit": "dea49853619eaf2e5b7c18d6f89a1c1bf67567a0",
      "pr_ref": null
    },
    {
      "run_id": "c1e40371720d768e",
      "task_id": "implement",
      "task_version": 1,
      "ticket_id": "34",
      "state": "SUCCEEDED",
      "attempt": 0,
      "bindings": {
        "tracker": "github-issues",
        "agent-session": "copilot-cli",
        "messaging": "github-comment"
      },
      "cost_usd": 0.697,
      "tokens": 1212000,
      "usage_known": true,
      "artifacts": [
        "specs/34/qa-plan.md"
      ],
      "chain_depth": 1,
      "parent_run_id": "d0a9c2f44340151b",
      "queue_seq": 1,
      "handoff_key": "impl-care-fe",
      "repo": "yash-learner/care_fe_agent_hq",
      "input_artifacts": [
        "specs/34/spec.md"
      ],
      "deadline": "2026-08-07T22:07:47Z",
      "attempt_started_at": "2026-08-07T20:37:47Z",
      "base_commit": "dea49853619eaf2e5b7c18d6f89a1c1bf67567a0",
      "input_from_run_id": "d0a9c2f44340151b",
      "output_commit": "d9a69db5f55859557b830e2dc364662119298f1e",
      "pr_ref": "yash-learner/care_fe_agent_hq#17"
    },
    {
      "run_id": "9dc1d4f1935314b2",
      "task_id": "review",
      "task_version": 1,
      "ticket_id": "34",
      "state": "SUCCEEDED",
      "attempt": 0,
      "bindings": {
        "tracker": "github-issues",
        "agent-session": "copilot-cli",
        "messaging": "github-comment"
      },
      "cost_usd": 0.27,
      "tokens": 401300,
      "usage_known": true,
      "artifacts": [
        "specs/34/review.md"
      ],
      "chain_depth": 2,
      "parent_run_id": "c1e40371720d768e",
      "queue_seq": 2,
      "handoff_key": "review-34",
      "repo": "yash-learner/care_fe_agent_hq",
      "input_artifacts": [
        "specs/34/spec.md",
        "specs/34/qa-plan.md"
      ],
      "deadline": "2026-08-07T21:15:03Z",
      "attempt_started_at": "2026-08-07T20:45:03Z",
      "base_commit": "d9a69db5f55859557b830e2dc364662119298f1e",
      "input_from_run_id": "c1e40371720d768e",
      "output_commit": "d9a69db5f55859557b830e2dc364662119298f1e",
      "pr_ref": "yash-learner/care_fe_agent_hq#17"
    },
    {
      "run_id": "16fa7c787a1c4210",
      "task_id": "implement",
      "task_version": 1,
      "ticket_id": "34",
      "state": "SUCCEEDED",
      "attempt": 0,
      "bindings": {
        "tracker": "github-issues",
        "agent-session": "copilot-cli",
        "messaging": "github-comment"
      },
      "cost_usd": 0.631,
      "tokens": 942400,
      "usage_known": true,
      "artifacts": [
        "specs/34/qa-plan.md"
      ],
      "chain_depth": 3,
      "parent_run_id": "9dc1d4f1935314b2",
      "queue_seq": 3,
      "handoff_key": "implement-tests",
      "repo": "yash-learner/care_fe_agent_hq",
      "input_artifacts": [
        "specs/34/spec.md",
        "specs/34/review.md"
      ],
      "deadline": "2026-08-07T22:20:22Z",
      "attempt_started_at": "2026-08-07T20:50:22Z",
      "base_commit": "d9a69db5f55859557b830e2dc364662119298f1e",
      "input_from_run_id": "9dc1d4f1935314b2",
      "output_commit": "e7ba87b37f89648d92db142b7d000cc6f758b57a",
      "pr_ref": "yash-learner/care_fe_agent_hq#17"
    },
    {
      "run_id": "1f56268a5f95031f",
      "task_id": "review",
      "task_version": 1,
      "ticket_id": "34",
      "state": "SUCCEEDED",
      "attempt": 0,
      "bindings": {
        "tracker": "github-issues",
        "agent-session": "copilot-cli",
        "messaging": "github-comment"
      },
      "cost_usd": 0.518,
      "tokens": 987200,
      "usage_known": true,
      "artifacts": [
        "specs/34/review.md"
      ],
      "chain_depth": 4,
      "parent_run_id": "16fa7c787a1c4210",
      "queue_seq": 4,
      "handoff_key": "review-34-2",
      "repo": "yash-learner/care_fe_agent_hq",
      "input_artifacts": [
        "specs/34/spec.md",
        "specs/34/review.md",
        "specs/34/qa-plan.md"
      ],
      "deadline": "2026-08-07T21:30:33Z",
      "attempt_started_at": "2026-08-07T21:00:33Z",
      "base_commit": "e7ba87b37f89648d92db142b7d000cc6f758b57a",
      "input_from_run_id": "16fa7c787a1c4210",
      "output_commit": "e7ba87b37f89648d92db142b7d000cc6f758b57a",
      "pr_ref": "yash-learner/care_fe_agent_hq#17"
    },
    {
      "run_id": "48456ee0d07f0ed3",
      "task_id": "implement",
      "task_version": 1,
      "ticket_id": "34",
      "state": "SUCCEEDED",
      "attempt": 0,
      "bindings": {
        "tracker": "github-issues",
        "agent-session": "copilot-cli",
        "messaging": "github-comment"
      },
      "cost_usd": 0.508,
      "tokens": 710500,
      "usage_known": true,
      "artifacts": [
        "specs/34/qa-plan.md"
      ],
      "chain_depth": 5,
      "parent_run_id": "1f56268a5f95031f",
      "queue_seq": 5,
      "handoff_key": "implement-3",
      "repo": "yash-learner/care_fe_agent_hq",
      "input_artifacts": [
        "specs/34/spec.md",
        "specs/34/review.md"
      ],
      "deadline": "2026-08-07T22:37:23Z",
      "attempt_started_at": "2026-08-07T21:07:23Z",
      "base_commit": "e7ba87b37f89648d92db142b7d000cc6f758b57a",
      "input_from_run_id": "1f56268a5f95031f",
      "output_commit": "c4f20bc6884e0198233824377fe9677a50f136d8",
      "pr_ref": "yash-learner/care_fe_agent_hq#17"
    },
    {
      "run_id": "3f521a18cee6337a",
      "task_id": "review",
      "task_version": 1,
      "ticket_id": "34",
      "state": "SUCCEEDED",
      "attempt": 0,
      "bindings": {
        "tracker": "github-issues",
        "agent-session": "copilot-cli",
        "messaging": "github-comment"
      },
      "cost_usd": 0.431,
      "tokens": 720000,
      "usage_known": true,
      "artifacts": [
        "specs/34/review.md"
      ],
      "chain_depth": 6,
      "parent_run_id": "48456ee0d07f0ed3",
      "queue_seq": 6,
      "handoff_key": "review-round-3",
      "repo": "yash-learner/care_fe_agent_hq",
      "input_artifacts": [
        "specs/34/spec.md",
        "specs/34/review.md",
        "specs/34/qa-plan.md"
      ],
      "deadline": "2026-08-07T21:44:23Z",
      "attempt_started_at": "2026-08-07T21:14:23Z",
      "base_commit": "c4f20bc6884e0198233824377fe9677a50f136d8",
      "input_from_run_id": "48456ee0d07f0ed3",
      "output_commit": "c4f20bc6884e0198233824377fe9677a50f136d8",
      "pr_ref": "yash-learner/care_fe_agent_hq#17"
    },
    {
      "run_id": "0a50693f19f7fea1",
      "task_id": "qa",
      "task_version": 1,
      "ticket_id": "34",
      "state": "RUNNING",
      "attempt": 0,
      "bindings": {
        "tracker": "github-issues",
        "agent-session": "copilot-cli",
        "messaging": "github-comment"
      },
      "cost_usd": 1.03,
      "tokens": 1917700,
      "usage_known": true,
      "artifacts": [],
      "chain_depth": 7,
      "parent_run_id": "3f521a18cee6337a",
      "queue_seq": 7,
      "handoff_key": "qa-34",
      "repo": "yash-learner/care_fe_agent_hq",
      "input_artifacts": [
        "specs/34/spec.md",
        "specs/34/review.md",
        "specs/34/qa-plan.md"
      ],
      "deadline": "2026-08-07T22:20:26Z",
      "attempt_started_at": "2026-08-07T21:20:26Z",
      "base_commit": "c4f20bc6884e0198233824377fe9677a50f136d8",
      "input_from_run_id": "3f521a18cee6337a"
    }
  ],
  "block_reason": null,
  "block_source": null,
  "interrupted_run_id": null,
  "comments_polled_at": "2026-08-07T20:37:03Z",
  "work_repos": [
    {
      "repo": "yash-learner/care_fe_agent_hq",
      "branch": "agent-hq/34",
      "base_branch": "develop",
      "recorded_head": "c4f20bc6884e0198233824377fe9677a50f136d8",
      "pr_ref": "yash-learner/care_fe_agent_hq#17",
      "comments_polled_at": "2026-08-07T21:19:29Z"
    }
  ]
}
