{
  "ticket_id": "22",
  "pinned_comment_id": 5217523640,
  "status": "ACTIVE",
  "runs": [
    {
      "run_id": "36845cf5af9104d2",
      "task_id": "spec",
      "task_version": 1,
      "ticket_id": "22",
      "state": "SUCCEEDED",
      "attempt": 0,
      "bindings": {
        "tracker": "github-issues",
        "agent-session": "copilot-cli",
        "messaging": "github-comment",
        "gate": "github-issue-comment"
      },
      "cost_usd": 0.533,
      "tokens": 718500,
      "usage_known": true,
      "artifacts": [
        "specs/22/spec.md"
      ],
      "chain_depth": 0,
      "source_event_id": "22:labeled:2026-08-07T13:13:44Z",
      "enqueue_index": 0,
      "queue_seq": 0,
      "repo": "yash-learner/care_fe_agent_hq",
      "deadline": "2026-08-07T13:45:06Z",
      "attempt_started_at": "2026-08-07T13:15:06Z",
      "base_commit": "dea49853619eaf2e5b7c18d6f89a1c1bf67567a0",
      "input_from_run_id": null,
      "input_artifacts": [],
      "output_commit": "dea49853619eaf2e5b7c18d6f89a1c1bf67567a0",
      "pr_ref": null
    },
    {
      "run_id": "65d9dae07d104fa6",
      "task_id": "arch-plan",
      "task_version": 1,
      "ticket_id": "22",
      "state": "SUCCEEDED",
      "attempt": 0,
      "bindings": {
        "tracker": "github-issues",
        "agent-session": "copilot-cli",
        "messaging": "github-comment"
      },
      "cost_usd": 0.314,
      "tokens": 386400,
      "usage_known": true,
      "artifacts": [
        "specs/22/plan.md",
        "specs/22/classification.json"
      ],
      "chain_depth": 1,
      "parent_run_id": "36845cf5af9104d2",
      "queue_seq": 1,
      "handoff_key": "arch-plan-22",
      "repo": "yash-learner/care_fe_agent_hq",
      "input_artifacts": [
        "specs/22/spec.md"
      ],
      "deadline": "2026-08-07T13:50:53Z",
      "attempt_started_at": "2026-08-07T13:20:53Z",
      "base_commit": "dea49853619eaf2e5b7c18d6f89a1c1bf67567a0",
      "input_from_run_id": "36845cf5af9104d2",
      "output_commit": "dea49853619eaf2e5b7c18d6f89a1c1bf67567a0",
      "pr_ref": null
    },
    {
      "run_id": "a08a427f064dc493",
      "task_id": "breakdown",
      "task_version": 1,
      "ticket_id": "22",
      "state": "SUCCEEDED",
      "attempt": 0,
      "bindings": {
        "tracker": "github-issues",
        "agent-session": "copilot-cli",
        "messaging": "github-comment"
      },
      "cost_usd": 0.213,
      "tokens": 262700,
      "usage_known": true,
      "artifacts": [
        "specs/22/tasks.md"
      ],
      "chain_depth": 2,
      "parent_run_id": "65d9dae07d104fa6",
      "queue_seq": 2,
      "handoff_key": "breakdown-1",
      "repo": "yash-learner/care_fe_agent_hq",
      "input_artifacts": [
        "specs/22/spec.md",
        "specs/22/plan.md",
        "specs/22/classification.json"
      ],
      "deadline": "2026-08-07T13:56:28Z",
      "attempt_started_at": "2026-08-07T13:26:28Z",
      "base_commit": "dea49853619eaf2e5b7c18d6f89a1c1bf67567a0",
      "input_from_run_id": "65d9dae07d104fa6",
      "output_commit": "dea49853619eaf2e5b7c18d6f89a1c1bf67567a0",
      "pr_ref": null
    },
    {
      "run_id": "bf5df67910a567a2",
      "task_id": "implement",
      "task_version": 1,
      "ticket_id": "22",
      "state": "SUCCEEDED",
      "attempt": 0,
      "bindings": {
        "tracker": "github-issues",
        "agent-session": "copilot-cli",
        "messaging": "github-comment"
      },
      "cost_usd": 1.25,
      "tokens": 2116200,
      "usage_known": true,
      "artifacts": [
        "specs/22/qa-plan.md"
      ],
      "chain_depth": 3,
      "parent_run_id": "a08a427f064dc493",
      "queue_seq": 3,
      "handoff_key": "implement-care-fe",
      "repo": "yash-learner/care_fe_agent_hq",
      "input_artifacts": [
        "specs/22/spec.md",
        "specs/22/plan.md",
        "specs/22/tasks.md",
        "specs/22/classification.json"
      ],
      "deadline": "2026-08-07T15:01:58Z",
      "attempt_started_at": "2026-08-07T13:31:58Z",
      "base_commit": "dea49853619eaf2e5b7c18d6f89a1c1bf67567a0",
      "input_from_run_id": "a08a427f064dc493",
      "output_commit": "d8896152354a7e080333387d6ebe74f7773f4c51",
      "pr_ref": "yash-learner/care_fe_agent_hq#12"
    },
    {
      "run_id": "742375bf360576be",
      "task_id": "review",
      "task_version": 1,
      "ticket_id": "22",
      "state": "SUCCEEDED",
      "attempt": 0,
      "bindings": {
        "tracker": "github-issues",
        "agent-session": "copilot-cli",
        "messaging": "github-comment"
      },
      "cost_usd": 0.389,
      "tokens": 654400,
      "usage_known": true,
      "artifacts": [
        "specs/22/review.md"
      ],
      "chain_depth": 4,
      "parent_run_id": "bf5df67910a567a2",
      "queue_seq": 4,
      "handoff_key": "review-22",
      "repo": "yash-learner/care_fe_agent_hq",
      "input_artifacts": [
        "specs/22/spec.md",
        "specs/22/qa-plan.md"
      ],
      "deadline": "2026-08-07T14:13:01Z",
      "attempt_started_at": "2026-08-07T13:43:01Z",
      "base_commit": "d8896152354a7e080333387d6ebe74f7773f4c51",
      "input_from_run_id": "bf5df67910a567a2",
      "output_commit": "d8896152354a7e080333387d6ebe74f7773f4c51",
      "pr_ref": "yash-learner/care_fe_agent_hq#12"
    },
    {
      "run_id": "6262936b3b0f0292",
      "task_id": "implement",
      "task_version": 1,
      "ticket_id": "22",
      "state": "QUEUED",
      "attempt": 0,
      "bindings": {
        "tracker": "github-issues",
        "agent-session": "copilot-cli",
        "messaging": "github-comment"
      },
      "cost_usd": null,
      "tokens": null,
      "usage_known": false,
      "artifacts": [],
      "chain_depth": 5,
      "parent_run_id": "742375bf360576be",
      "queue_seq": 5,
      "handoff_key": "implement-round-2",
      "repo": "yash-learner/care_fe_agent_hq",
      "input_artifacts": [
        "specs/22/spec.md",
        "specs/22/review.md",
        "specs/22/qa-plan.md"
      ]
    }
  ],
  "block_reason": null,
  "block_source": null,
  "interrupted_run_id": null,
  "comments_polled_at": "2026-08-07T13:20:02Z",
  "work_repos": [
    {
      "repo": "yash-learner/care_fe_agent_hq",
      "branch": "agent-hq/22",
      "base_branch": "develop",
      "recorded_head": "d8896152354a7e080333387d6ebe74f7773f4c51",
      "pr_ref": "yash-learner/care_fe_agent_hq#12",
      "comments_polled_at": "2026-08-07T13:42:12Z"
    }
  ]
}
