{
  "ticket_id": "29",
  "pinned_comment_id": 5221474339,
  "status": "ACTIVE",
  "runs": [
    {
      "run_id": "107bc05e6b47e0c4",
      "task_id": "spec",
      "task_version": 1,
      "ticket_id": "29",
      "state": "SUCCEEDED",
      "attempt": 0,
      "bindings": {
        "tracker": "github-issues",
        "agent-session": "copilot-cli",
        "messaging": "github-comment",
        "gate": "github-issue-comment"
      },
      "cost_usd": 0.462,
      "tokens": 715600,
      "usage_known": true,
      "artifacts": [
        "specs/29/spec.md"
      ],
      "chain_depth": 0,
      "source_event_id": "29:opened:2026-08-07T20:00:14Z",
      "enqueue_index": 0,
      "queue_seq": 0,
      "repo": "yash-learner/care_fe_agent_hq",
      "deadline": "2026-08-07T23:11:58Z",
      "attempt_started_at": "2026-08-07T22:41:58Z",
      "base_commit": "dea49853619eaf2e5b7c18d6f89a1c1bf67567a0",
      "input_from_run_id": null,
      "input_artifacts": [],
      "output_commit": "dea49853619eaf2e5b7c18d6f89a1c1bf67567a0",
      "pr_ref": null
    },
    {
      "run_id": "1c6d0d4bf25402cd",
      "task_id": "arch-plan",
      "task_version": 1,
      "ticket_id": "29",
      "state": "SUCCEEDED",
      "attempt": 0,
      "bindings": {
        "tracker": "github-issues",
        "agent-session": "copilot-cli",
        "messaging": "github-comment"
      },
      "cost_usd": 0.187,
      "tokens": 188200,
      "usage_known": true,
      "artifacts": [
        "specs/29/plan.md",
        "specs/29/classification.json"
      ],
      "chain_depth": 1,
      "parent_run_id": "107bc05e6b47e0c4",
      "queue_seq": 1,
      "handoff_key": "arch-plan-29",
      "repo": "yash-learner/care_fe_agent_hq",
      "input_artifacts": [
        "specs/29/spec.md"
      ],
      "deadline": "2026-08-07T23:17:32Z",
      "attempt_started_at": "2026-08-07T22:47:32Z",
      "base_commit": "dea49853619eaf2e5b7c18d6f89a1c1bf67567a0",
      "input_from_run_id": "107bc05e6b47e0c4",
      "output_commit": "dea49853619eaf2e5b7c18d6f89a1c1bf67567a0",
      "pr_ref": null
    },
    {
      "run_id": "298ee1b8747c5502",
      "task_id": "breakdown",
      "task_version": 1,
      "ticket_id": "29",
      "state": "SUCCEEDED",
      "attempt": 0,
      "bindings": {
        "tracker": "github-issues",
        "agent-session": "copilot-cli",
        "messaging": "github-comment"
      },
      "cost_usd": 0.302,
      "tokens": 446600,
      "usage_known": true,
      "artifacts": [
        "specs/29/tasks.md"
      ],
      "chain_depth": 2,
      "parent_run_id": "1c6d0d4bf25402cd",
      "queue_seq": 2,
      "handoff_key": "breakdown-1",
      "repo": "yash-learner/care_fe_agent_hq",
      "input_artifacts": [
        "specs/29/spec.md",
        "specs/29/plan.md",
        "specs/29/classification.json"
      ],
      "deadline": "2026-08-07T23:22:11Z",
      "attempt_started_at": "2026-08-07T22:52:11Z",
      "base_commit": "dea49853619eaf2e5b7c18d6f89a1c1bf67567a0",
      "input_from_run_id": "1c6d0d4bf25402cd",
      "output_commit": "dea49853619eaf2e5b7c18d6f89a1c1bf67567a0",
      "pr_ref": null
    },
    {
      "run_id": "79047e6aaf053580",
      "task_id": "implement",
      "task_version": 1,
      "ticket_id": "29",
      "state": "SUCCEEDED",
      "attempt": 0,
      "bindings": {
        "tracker": "github-issues",
        "agent-session": "copilot-cli",
        "messaging": "github-comment"
      },
      "cost_usd": 0.842,
      "tokens": 1415500,
      "usage_known": true,
      "artifacts": [
        "specs/29/qa-plan.md"
      ],
      "chain_depth": 3,
      "parent_run_id": "298ee1b8747c5502",
      "queue_seq": 3,
      "handoff_key": "implement-invoice-date-filter",
      "repo": "yash-learner/care_fe_agent_hq",
      "input_artifacts": [
        "specs/29/spec.md",
        "specs/29/plan.md",
        "specs/29/tasks.md",
        "specs/29/classification.json"
      ],
      "deadline": "2026-08-08T00:27:53Z",
      "attempt_started_at": "2026-08-07T22:57:53Z",
      "base_commit": "dea49853619eaf2e5b7c18d6f89a1c1bf67567a0",
      "input_from_run_id": "298ee1b8747c5502",
      "output_commit": "11048d1c8502bbe08c7493cc7d6a66a2172307bd",
      "pr_ref": "yash-learner/care_fe_agent_hq#20"
    },
    {
      "run_id": "250ce95a6a0ab4dc",
      "task_id": "review",
      "task_version": 1,
      "ticket_id": "29",
      "state": "QUEUED",
      "attempt": 0,
      "bindings": {
        "tracker": "github-issues",
        "agent-session": "copilot-cli",
        "messaging": "github-comment"
      },
      "cost_usd": null,
      "tokens": null,
      "usage_known": false,
      "artifacts": [],
      "chain_depth": 4,
      "parent_run_id": "79047e6aaf053580",
      "queue_seq": 4,
      "handoff_key": "review-29-implement",
      "repo": "yash-learner/care_fe_agent_hq",
      "input_artifacts": [
        "specs/29/spec.md",
        "specs/29/qa-plan.md"
      ]
    }
  ],
  "block_reason": null,
  "block_source": null,
  "interrupted_run_id": null,
  "comments_polled_at": "2026-08-07T22:46:43Z",
  "work_repos": [
    {
      "repo": "yash-learner/care_fe_agent_hq",
      "branch": "agent-hq/29",
      "base_branch": "develop",
      "recorded_head": "11048d1c8502bbe08c7493cc7d6a66a2172307bd",
      "pr_ref": "yash-learner/care_fe_agent_hq#20"
    }
  ]
}
