{
  "ticket_id": "30",
  "pinned_comment_id": 5221479239,
  "status": "ACTIVE",
  "runs": [
    {
      "run_id": "9a7ce79dfd9a5639",
      "task_id": "spec",
      "task_version": 1,
      "ticket_id": "30",
      "state": "FAILED",
      "attempt": 0,
      "bindings": {
        "tracker": "github-issues",
        "agent-session": "copilot-cli",
        "messaging": "github-comment",
        "gate": "github-issue-comment"
      },
      "cost_usd": null,
      "tokens": null,
      "usage_known": false,
      "artifacts": [],
      "chain_depth": 0,
      "source_event_id": "30:opened:2026-08-07T20:00:52Z",
      "enqueue_index": 0,
      "queue_seq": 0,
      "repo": "yash-learner/care_fe_agent_hq",
      "deadline": "2026-08-07T22:22:13Z",
      "attempt_started_at": "2026-08-07T21:52:13Z",
      "base_commit": "dea49853619eaf2e5b7c18d6f89a1c1bf67567a0",
      "input_from_run_id": null,
      "input_artifacts": []
    },
    {
      "run_id": "f794389fd9e827a5",
      "task_id": "spec",
      "task_version": 1,
      "ticket_id": "30",
      "state": "SUCCEEDED",
      "attempt": 1,
      "bindings": {
        "tracker": "github-issues",
        "agent-session": "copilot-cli",
        "messaging": "github-comment",
        "gate": "github-issue-comment"
      },
      "cost_usd": 0.446,
      "tokens": 679200,
      "usage_known": true,
      "artifacts": [
        "specs/30/spec.md"
      ],
      "chain_depth": 0,
      "source_event_id": "30:opened:2026-08-07T20:00:52Z",
      "enqueue_index": 0,
      "queue_seq": 0,
      "deadline": "2026-08-07T23:50:05Z",
      "attempt_started_at": "2026-08-07T23:20:05Z",
      "base_commit": "dea49853619eaf2e5b7c18d6f89a1c1bf67567a0",
      "input_from_run_id": null,
      "input_artifacts": [],
      "output_commit": "dea49853619eaf2e5b7c18d6f89a1c1bf67567a0",
      "pr_ref": null
    },
    {
      "run_id": "c2b96065f5963bb6",
      "task_id": "implement",
      "task_version": 1,
      "ticket_id": "30",
      "state": "SUCCEEDED",
      "attempt": 0,
      "bindings": {
        "tracker": "github-issues",
        "agent-session": "copilot-cli",
        "messaging": "github-comment"
      },
      "cost_usd": 1.39,
      "tokens": 2920300,
      "usage_known": true,
      "artifacts": [
        "specs/30/qa-plan.md"
      ],
      "chain_depth": 1,
      "parent_run_id": "f794389fd9e827a5",
      "queue_seq": 1,
      "handoff_key": "implement-30-date-filter",
      "repo": "yash-learner/care_fe_agent_hq",
      "input_artifacts": [
        "specs/30/spec.md"
      ],
      "deadline": "2026-08-08T00:56:02Z",
      "attempt_started_at": "2026-08-07T23:26:02Z",
      "base_commit": "dea49853619eaf2e5b7c18d6f89a1c1bf67567a0",
      "input_from_run_id": "f794389fd9e827a5",
      "output_commit": "2f59e43c0cef221cf4f18474614fd8a67c01e17a",
      "pr_ref": "yash-learner/care_fe_agent_hq#21"
    },
    {
      "run_id": "f645d0cc031c3167",
      "task_id": "review",
      "task_version": 1,
      "ticket_id": "30",
      "state": "SUCCEEDED",
      "attempt": 0,
      "bindings": {
        "tracker": "github-issues",
        "agent-session": "copilot-cli",
        "messaging": "github-comment"
      },
      "cost_usd": 0.247,
      "tokens": 333200,
      "usage_known": true,
      "artifacts": [
        "specs/30/review.md"
      ],
      "chain_depth": 2,
      "parent_run_id": "c2b96065f5963bb6",
      "queue_seq": 2,
      "handoff_key": "review-30",
      "repo": "yash-learner/care_fe_agent_hq",
      "input_artifacts": [
        "specs/30/spec.md",
        "specs/30/qa-plan.md"
      ],
      "deadline": "2026-08-08T00:07:06Z",
      "attempt_started_at": "2026-08-07T23:37:06Z",
      "base_commit": "2f59e43c0cef221cf4f18474614fd8a67c01e17a",
      "input_from_run_id": "c2b96065f5963bb6",
      "output_commit": "2f59e43c0cef221cf4f18474614fd8a67c01e17a",
      "pr_ref": "yash-learner/care_fe_agent_hq#21"
    },
    {
      "run_id": "60edf3d81edd5068",
      "task_id": "implement",
      "task_version": 1,
      "ticket_id": "30",
      "state": "SUCCEEDED",
      "attempt": 0,
      "bindings": {
        "tracker": "github-issues",
        "agent-session": "copilot-cli",
        "messaging": "github-comment"
      },
      "cost_usd": 0.782,
      "tokens": 1511600,
      "usage_known": true,
      "artifacts": [
        "specs/30/qa-plan.md"
      ],
      "chain_depth": 3,
      "parent_run_id": "f645d0cc031c3167",
      "queue_seq": 3,
      "handoff_key": "implement-tests",
      "repo": "yash-learner/care_fe_agent_hq",
      "input_artifacts": [
        "specs/30/spec.md",
        "specs/30/review.md",
        "specs/30/qa-plan.md"
      ],
      "deadline": "2026-08-08T01:11:48Z",
      "attempt_started_at": "2026-08-07T23:41:48Z",
      "base_commit": "2f59e43c0cef221cf4f18474614fd8a67c01e17a",
      "input_from_run_id": "f645d0cc031c3167",
      "output_commit": "7e947f13ac06de2ef0c4844535507b6a33d7993b",
      "pr_ref": "yash-learner/care_fe_agent_hq#21"
    },
    {
      "run_id": "2d4a2c4bdd1da964",
      "task_id": "review",
      "task_version": 1,
      "ticket_id": "30",
      "state": "SUCCEEDED",
      "attempt": 0,
      "bindings": {
        "tracker": "github-issues",
        "agent-session": "copilot-cli",
        "messaging": "github-comment"
      },
      "cost_usd": 0.599,
      "tokens": 917400,
      "usage_known": true,
      "artifacts": [
        "specs/30/review.md"
      ],
      "chain_depth": 4,
      "parent_run_id": "60edf3d81edd5068",
      "queue_seq": 4,
      "handoff_key": "review-round-2",
      "repo": "yash-learner/care_fe_agent_hq",
      "input_artifacts": [
        "specs/30/spec.md",
        "specs/30/qa-plan.md",
        "specs/30/review.md"
      ],
      "deadline": "2026-08-08T00:19:41Z",
      "attempt_started_at": "2026-08-07T23:49:41Z",
      "base_commit": "7e947f13ac06de2ef0c4844535507b6a33d7993b",
      "input_from_run_id": "60edf3d81edd5068",
      "output_commit": "7e947f13ac06de2ef0c4844535507b6a33d7993b",
      "pr_ref": "yash-learner/care_fe_agent_hq#21"
    },
    {
      "run_id": "08e52252341cec02",
      "task_id": "qa",
      "task_version": 1,
      "ticket_id": "30",
      "state": "QUEUED",
      "attempt": 0,
      "bindings": {
        "tracker": "github-issues",
        "agent-session": "copilot-cli",
        "messaging": "github-comment"
      },
      "cost_usd": null,
      "tokens": null,
      "usage_known": false,
      "artifacts": [],
      "chain_depth": 5,
      "parent_run_id": "2d4a2c4bdd1da964",
      "queue_seq": 5,
      "handoff_key": "qa-30",
      "repo": "yash-learner/care_fe_agent_hq",
      "input_artifacts": [
        "specs/30/spec.md",
        "specs/30/review.md",
        "specs/30/qa-plan.md"
      ]
    }
  ],
  "block_reason": null,
  "block_source": null,
  "interrupted_run_id": null,
  "comments_polled_at": "2026-08-07T23:25:13Z",
  "work_repos": [
    {
      "repo": "yash-learner/care_fe_agent_hq",
      "branch": "agent-hq/30",
      "base_branch": "develop",
      "recorded_head": "7e947f13ac06de2ef0c4844535507b6a33d7993b",
      "pr_ref": "yash-learner/care_fe_agent_hq#21",
      "comments_polled_at": "2026-08-07T23:56:22Z"
    }
  ]
}
